<?xml version="1.0"?>

<ruleset name="510"
    xmlns="http://pmd.sourceforge.net/ruleset/2.0.0"
    xmlns:xsi="http://www.w3.org/2001/XMLSchema-instance"
    xsi:schemaLocation="http://pmd.sourceforge.net/ruleset/2.0.0 http://pmd.sourceforge.net/ruleset_2_0_0.xsd">
  <description>
This ruleset contains links to rules that are new in PMD v5.1.0
  </description>

    <rule ref="rulesets/java/logging-jakarta-commons.xml/GuardLogStatement"/>
    <rule ref="rulesets/java/logging-java.xml/GuardLogStatementJavaUtil"/>
    <rule ref="rulesets/java/comments.xml/CommentRequired"/>
    <rule ref="rulesets/java/design.xml/AvoidProtectedMethodInFinalClassNotExtending"/>
    <rule ref="rulesets/java/design.xml/PositionLiteralsFirstInCaseInsensitiveComparisons"/>
    <rule ref="rulesets/java/strings.xml/ConsecutiveAppendsShouldReuse"/>
</ruleset>

