<?xml version="1.0"?>

<ruleset name="All Apex Rules" 
    xmlns="http://pmd.sourceforge.net/ruleset/2.0.0"
    xmlns:xsi="http://www.w3.org/2001/XMLSchema-instance"
    xsi:schemaLocation="http://pmd.sourceforge.net/ruleset/2.0.0 https://pmd.sourceforge.io/ruleset_2_0_0.xsd">
    <description>Every Apex Rule in PMD</description>

    <rule ref="category/apex/bestpractices.xml" />
    <rule ref="category/apex/codestyle.xml" />
    <rule ref="category/apex/design.xml" />
    <rule ref="category/apex/documentation.xml" />
    <rule ref="category/apex/errorprone.xml" />
    <rule ref="category/apex/multithreading.xml" />
    <rule ref="category/apex/performance.xml" />
    <rule ref="category/apex/security.xml" />

</ruleset>
